company_name,services_provided,mbe_wbe_cert,small_local_cert,veteran_cert,sdo_certified,city_registered,address,city,state,zipcode,contact_name,contact_title,phone,fax,email,website,business_type,construction,date_established,number_employees,cob_category_codes1,cob_category_codes2,cob_category_codes3,naics_codes1,naics_codes2,naics_codes3,unspsc_code1,unspsc_code2,unspsc_code3
Weisswoman Productions,"Video production, videography, video editing, cinematography",WBE,SBE,,Yes,Yes,"112 Belmont Street, Somerville, MA 2143",Somerville,MA,2143,Lynn Weissman,,(617) 776-7769,,lynn@weisswomanproductions.com,,Sole Proprietorship,No,01/01/2006,Less than 10,TV - Television/Production,AD - Advertising/Audovisual Graphic Design/Marketing Public Relations,MK - Marketing,512110 - Motion Picture and Video Production ,512191 - Teleproduction and Other Postproduction Services ,512199 - Other Motion Picture and Video Industries ,,,
"Wescon Personal Protection, Inc.",Security Guard Services,MBE,SBE,,Yes,No,"6 Cabot Place, Stoughton, MA 2072",Stoughton,MA,2072,Mark Conrad,,(781) 961-1184,,wesconfive@gmail.com,,Corporation,No,01/01/2001,41 - 100,"SE - Security (Guards, Dogs, Systems)",,,561612 - Security Guards and Patrol Services ,561621 - Security Systems Services (except Locksmiths) ,,92120000 - Security and personal safety,,
"West Faulkner, LLC",Architectural services,WBE,,,Yes,Yes,"15 Dresden Street, Boston, MA 2130",Boston,MA,2130,Katherine Faulkner,,(617) 894-9152,,katie@westfaulkner.com,,Limited Liability Company,No,01/01/2020,Less than 10,AE - Architects/Engineers,,,541310 - Architectural Services,,,,,
West Roxbury Dental Arts,"General dentistry services:  exams, cleanings, fillings, crowns, etc.",MWBE,SLBE,,No,Yes,"1811 Centre Street, West Roxbury, MA 2132",West Roxbury,MA,2132,Srismitha Modem,,(617) 323-0080,(888) 445-7972,sridentalarts@gmail.com,,Corporation,No,01/01/2015,Less than 10,"AHS - Health Care (Providers, Services)",,,621210 - Offices of Dentists ,,,,,
"Westview Building Company, Inc.",Drywall installation and light guage metal framing,MWBE,,,Yes,Yes,"29 Stanton Street, Boston, MA 2124",Boston,MA,2124,Nicquearl Langley,,(617) 320-8749,,mlangley@westviewbuild.com,,Corporation,Yes,01/01/2015,20-Nov,"PL - Plastering, Drywall Contractors",,,238310 - Drywall and Insulation Contractors ,,,,,
Williams and Taylor,Background Searches; Asset Searches; Document Retrieval; Property Analysis   ,MBE,SBE,,No,No,"890 Watertown Street, Newton, MA 02465",Newton,MA,02465,Alvin Taylor,"Alvin Taylor, Owner",(617) 359-6559,(617) 332-2889,taylor@threadwear.net,,Corporation,No,01/01/1992,Less than 10,FI - Financial Services (see also BA and COI),,,561611 - Investigation Services ,,,83120000 - Information services,,
"Windwalker Group, LLC","Physical security, cyber security, training development, online learning development tools, research and project management services",MBE,,,No,Yes,"67 Kemble Street, 3rd Floor, Suite 3, Boston, MA 2119",Boston,MA,2119,Herby Duverne,,(617) 797-9316,,herby.duverne@windwalker.com,,Limited Liability Company,No,01/01/2001,Greater than 100,"SE - Security (Guards, Dogs, Systems)",TA - Training (see also ED),,561612 - Security Guards and Patrol Services ,,,,,
"Wiseiye, Inc.",IT project management:  network administration; technology certification training; data analytics and modeling; business process analysis; business process improvement   ,MWBE,SLBE,,Yes,No,"2823 Washington Street, Boston, MA 2119",Boston,MA,2119,Josie Haywood,,(857) 251-5191,,josie@wiseiye.com,,Corporation,No,01/01/2016,20-Nov,COS - Consultants: Systems Analysis,"CP - Computer (Hardware, Software, Design, Data Processing (see also COS, COT)",,541519 - Other Computer Related Services,,,,,
"Woodworks Architectural Millwork, Inc., The","Manufacturer of finished millwork, casework and trim   ",WBE,SBE,,No,No,"16 North Wentworth Avenue, Londonderry, NH 3053",Londonderry,NH,3053,Michele Bergeron,,(603) 432-4050,(603) 432-3906,mbergeron@twnh.com,,Corporation,Yes,01/01/1985,41 - 100,MU - Manufacturers,SU - Suppliers,,321911 - Wood Window and Door Manufacturing ,321918 - Other Millwork (including Flooring) ,,,,
Workplace Resource,Office furniture:  furniture; design; space planning; delivery; installation   ,WBE,,,Yes,Yes,"162 Prescott Street, Worcester, MA 1605",Worcester,MA,1605,Claudia Russo,,(508) 770-1900,(508) 770-1905,crusso@wprltd.com,,Corporation,No,01/01/2000,Less than 10,IT - Interior Deisgn Services,"FR - Furniture (Repair, Refinishing, Sales) see also OF","OF - Office Furniture, Services and Equipment",,,,,,
"WRIGHT Property, LLC","Architectural design consultation and property management; real estate-brokerage and management; general contractor primarily responsible for the construction of new multifamily residential housing units and condominiums. multifamily design-build firm and multifamily housing construction management firm acting as general contractors, in addition to single family, commercial and industrial building construction.",MBE,SLBE,,No,Yes,"1 Elmwood Street, Boston, MA 2120",Boston,MA,2120,Scott Webster,"Scott Webster, Owner",(617) 427-4000,,scott@wright-property.com,,Limited Liability Company,No,01/01/2020,Less than 10,"RE - Real Estate (Development, Management, Sales and Appraisals)","AS - Architectural Support Services, Surveying",GC - General Contractors,531210 - Offices of Real Estate Agents and Brokers,541310 - Architectural Services,236116 - New Multifamily Housing Construction (except For-Sale Builders) ,80130000 - Real estate services,,
YOCOYOFU,Internet marketing agency,MBE,,,Yes,Yes,"770 Boylston Street, 22B, Boston, MA 2199",Boston,MA,2199,Jamie Jones,,(978) 451-7994,,jamie.jones@yocoyofu.com,,Corporation,No,01/01/2020,Less than 10,MK - Marketing,,,,,,80140000 - Marketing and distribution,,
"Zones, LLC",IT products and professional/managed services,MBE,,,Yes,No,"1102 15th Street, SW, Suite 102, Auburn, WA 98001",Auburn,WA,98001,Firoz Lalji,,(508) 740-9877,,bob.spencer@zones.com,,Limited Liability Company,No,01/01/1986,Greater than 100,"CP - Computer (Hardware, Software, Design, Data Processing (see also COS, COT)",COS - Consultants: Systems Analysis,,541512 - Computer Systems Design Services ,541519 - Other Computer Related Services,,,,
Boston Kokikai Aikido,"Martial Arts Lessons, Adult, Child",MWBE,"SBE, SLBE",,No,No,"12 Melrose Street, Boston, MA 02116",Boston,MA,02116,Heather Randolph,"Heather Randolph, Sensei, AKA, USA",(617) 834-6625,,info@kokikaiboston.com,http://wwww.kokikaiboston.com,Non Profit,No,08/21/2006,Less than 10,ET - Entertainment/Entertainer,COM - Consultants: Management,CC - Childcare,611620 - Sports and Recreation Instruction ,611610 - Fine Arts Schools ,611620 - Sports and Recreation Instruction ,49210000 - Other sports,46180000 - Personal safety and protection,94120000 - Clubs
"Crosswinds Enterprises, Inc.","Construction of buildings and other structures; renovating buildings, structures; and painting building structures   ",MBE,"SBE, SLBE",,Yes,No,"97 Humboldt Ave.,, Dorchester,, MA 02121","Dorchester,",MA,02121,Arnold Johnson,Arnold C. Johnson,(617) 445-5100,,tinat@crosswindsent.com,,Corporation,,,,GC - General Contractors,PA - Painting and Papering Contractors,,236116 - New Multifamily Housing Construction (except For-Sale Builders) ,236115 - New Single-Family Housing Construction (except For-Sale Builders) ,236118 - Residential Remodelers ,72110000 - Residential building construction services,,
"Pinnacle Construction Services, LLC",Installation and service of plumbing and mechanical systems,WBE,,,Yes,No,"950 Dorchester Avenue, Suite 103, Dorchester, MA 02125",Dorchester,MA,02125,Kourtney Mierzejewski,"Kourtney Mierzejewski, CEO",(617) 852-2271,,jdeamicis@pinnacle-constructionservices.com,,Limited Liability Company,,,,,,,"238220 - Plumbing, Heating, and Air-Conditioning Contractors ",,,30180000 - Plumbing fixtures,,
DVM Consulting LLC,Real estate development services,MWBE,"SBE, SLBE",,No,Yes,"228 Almont Street, Mattapan, MA 02126",Mattapan,MA,02126,Dariela Villon-Maga,"Dariela Villon-Maga, President/Owner",(857) 333-8180,,dvmaga01@gmail.com,www.dvmconsultingllc.com,Limited Liability Company,No,08/27/2020,Less than 10,,,,531390 - Other Activities Related to Real Estate ,,,80130000 - Real estate services,,
"Zelus Consulting Group, LLC","Management Consulting Services:
Change Management
Operations Analysis and Improvement
Training Design
Training Delivery",WBE,,,Yes,No,"7 Ronaele Road, Medford, MA 02155",Medford,MA,02155,Carol Fahy,"Carol Fahy, Partner; Jenny Graham, Partner",(781) 738-3145,,carol.fahy@zelusllc.com,www.zelusllc.com,Limited Liability Company,,,,BU - Business Management Consultants,COM - Consultants: Management,TA - Training (see also ED),541611 - Administrative Management and General Management Consulting Services ,,,80160000 - Business administration services,80100000 - Management advisory services,86110000 - Alternative educational systems
Quality and Assurance Technology dba QnA Tech,Information Technology; Cyber Security; Hardware and Software Resale,MBE,,,Yes,No,"18 Marginwood Druve, Ridge, NY 11961",Ridge,NY,11961,Marcos Merced,CEO,(646) 453-7119,,mbe@qnatech.com,,,No,01/01/2009,11 - 20,"CP - Computer (Hardware, Software, Design, Data Processing (see also COS, COT)",COS - Consultants: Systems Analysis,,541512 - Computer Systems Design Services ,423430 - Computer and Computer Peripheral Equipment and Software Merchant Wholesalers ,423710 - Hardware Merchant Wholesalers ,81110000 - Computer services,43210000 - Computer Equipment and Accessories,
"Studio Umbra, LLC",Architectural Services and Design,MBE,,,Yes,No,"69 Dale Avenue, Quincy, MA 02169",Quincy,MA,02169,Eugenio Fernandez,Owner,(787) 536-7004,,eugenio.fv@studio-umbra.com,,,No,2014,Less than 10,AE - Architects/Engineers,,,541310 - Architectural Services,,,72110000 - Residential building construction services,72120000 - Nonresidential building construction services,
SKYN Suits,Swimwear Retailer,MWBE,SLBE,,No,No,"20 Rockdale Street, Mattapan, MA 02126",Mattapan,MA,02126,Ashley Baker,Owner,(617) 480-6072,,skynsuits@gmail.com,www.skynsuits.com,,No,2020,Less than 10,RT - Retail Sales of Art & Framing,,,448120 - Women's Clothing Stores ,448150 - Clothing Accessories Stores ,,49240000 - Recreation and playground and swimming and spa equipment and supplies,,
Creliable,"Tax Preparation - Individual and Company; Tax Planning; Bookkeeping; Payroll Service; Virtual CFO
",MWBE,,,No,No,"Post Office Square, Boston, MA 02109",Boston,MA,02109,Shanli Liu,President,(781) 518-8739,,sliu@creliable.net,creliable.net,Sole Proprietorship,No,02/01/2018,Less than 10,AA - Accountants,,,541213 - Tax Preparation Services ,541219 - Other Accounting Services ,,93160000 - Taxation,84110000 - Accounting and bookkeeping services,
Evolution Resources LLC dba Soleil Restaurant,Restaurant; Catering,MWBE,"SBE, SLBE",,No,Yes,"2306 Washington Street, Roxbury, MA 02119",Roxbury,MA,02119,Cheryl Straughter,Owner,(617) 959-4041,,soleilboston617@gmail.com,,,No,2017,Less than 10,"FD - Food Products, Services",,,722511 - Full-Service Restaurants ,722320 - Caterers,,50190000 - Prepared and preserved foods,73130000 - Food and beverage industries,85150000 - Food and nutrition services
"Absolute Staffing & Consulting Solutions, LLC",Staffing Augmentation,MWBE,SBE,,No,No,"2221 Cherokee Drive, Westminster, MD 21157",Westminster,MD,21157,Tawanda Huff,Tawanda B. Huff - President/CEO,(410) 848-9480,,huff.t@ascs1.com,www.ascs1.com,Limited Liability Company,No,04/2006,41 - 100,"OS - Office Services (Clerical Support, Employment, Court Reporting, Typing, etc., see also EM)",,,524291 - Claims Adjusting ,"541990 - All Other Professional, Scientific, and Technical Services",561320 - Temporary Help Services,80110000 - Human resources services,,
Arrow and Stem,Eco-Friendly Home Goods and Decor,MBE,SLBE,,No,No,"1 Washington Street, Boston, MA 02108",Boston,MA,02108,Anthony Field,Mr. Anthony Field,(857) 529-8223,,anthony@arrowandstem.com,https://www.arrowandstem.com,Sole Proprietorship,No,"May 17, 2019",Less than 10,SU - Suppliers,MU - Manufacturers,,423220 - Home Furnishing Merchant Wholesalers ,"327110 - Pottery, Ceramics, and Plumbing Fixture Manufacturing ",332999 - All Other Miscellaneous Fabricated Metal Product Manufacturing ,30180000 - Plumbing fixtures,,
Moira Studio ,Advertising ,MWBE,,,No,No,"53 Prince Street , Cambridge , PA 02139",Cambridge ,PA,02139,Maria  Herrera,Maria Clemencia Herrera            CEO,(617) 877-3683,,operations@morastudio.com,Moirastudio.com,Limited Liability Company,No,1.07.2014,Less than 10,AD - Advertising/Audovisual Graphic Design/Marketing Public Relations,,,541810 - Advertising Agencies,541890 - Other Services Related to Advertising ,,82100000 - Advertising,,
BCapital Technologies Network Services LLC,Computer Repair; Network Design and Configuration; On Site and Remote IT Support,MBE,"SBE, SLBE",,No,No,"138 Medford Street, Boston, MA 02129",Boston,MA,02129,Bardwin Acosta,Owner ,(617) 549-1297,,bardwinacosta@bctig.com,bctig.com,Partnership,No,02/15/2019,Less than 10,"CP - Computer (Hardware, Software, Design, Data Processing (see also COS, COT)",,,541519 - Other Computer Related Services,,,81110000 - Computer services,,
"Ameritrade Corporate Holdings, Inc.",Import/Export Wholesale Trade,,SLBE,,No,No,"800 Boylston Street, 16th Floor, Boston, MA 02199",Boston,MA,02199,Robert Henthorn,President,(617) 889-5553,(617) 249-0720,robert.henthorn@ameritradegr.com,,,No,2018,Less than 10,SU - Suppliers,,,423990 - Other Miscellaneous Durable Goods Merchant Wholesalers ,,,14110000 - Paper products,46180000 - Personal safety and protection,
Umbro & Sons Construction Corp,"Water Main, Sewer Main, and Drain Main Replacement in public streets.",,SLBE,,No,No,"44 Reading Street, Boston, MA 02119",Boston,MA,02119,Paul Umbro,Paul N. Umbro - President & Treasurer,(617) 427-0030,,paul@umbroconstruction.com,www.wedigboston.com,Corporation,Yes,"March 31, 1973",21 - 40,"SI - Sitework (Excavation, Demolition, Utilities, Sewage, see also GC)","RO - Road, Railroad, Highway, Bridge Contractors (see also PV)",,237110 - Water and Sewer Line and Related Structures Construction ,,,83100000 - Utilities,,
SLOTHEL LLC,"Ecommerce; Retail; Clothing Brand; Shirts, Hoodies, Hats, Socks, Pants, Skirts, Dresses, Shoes, Jackets, Coats",MWBE,SLBE,,No,Yes,"22 Dracut Street, Boston, MA 02124",Boston,MA,02124,Kayla Martin,Slothel,(617) 913-6549,,owner@slothel.com,slothel.com,Limited Liability Company,Yes,03/05/2019,Less than 10,AL - Apparel,,,"315240 - Womens, Girls, and Infants Cut and Sew Apparel Manufacturing ",315220 - Mens and Boys Cut and Sew Apparel Manufacturing ,315280 - Other Cut and Sew Apparel Manufacturing ,53100000 - Clothing,,
ReIdren Business Group,Education Services,MBE,SLBE,,No,Yes,"21 Walnut Avenue, Roxbury, MA 02119",Roxbury,MA,02119,Joel Mackall,Project Developer,(765) 734-3736,,joel@reidren.com,www.reidren.com,,No,2006,Less than 10,"ED - Education (see also OS, TA)",TA - Training (see also ED),CU - Cultural Organizations,611699 - All Other Miscellaneous Schools and Instruction ,611420 - Computer Training ,611430 - Professional and Management Development Training ,86120000 - Educational institutions,,
Vtech H.v.a.c Solutions,"Heating Ventilation and Air Conditioning:  Installation, Sales, Service; and Air Quality and Environmental Consulting",MWBE,"SBE, SLBE",,No,Yes,"36 Seymour Street, Boston, MA 02131",Boston,MA,02131,Vanessa  Hackett,Vanessa Hackett ,(617) 651-7838,,vanessa.hackett@icloud.com,,Corporation,Yes,10/26/2020,Less than 10,RS - Residential Services,CON - Consultants: Environmental,"ME - Mechanical Contractors (HVAC, Plumbing, Insulation, Service, see also GC, PB)","238220 - Plumbing, Heating, and Air-Conditioning Contractors ",541618 - Other Management Consulting Services ,,40100000 - Heating and ventilation and air circulation,72100000 - Building and facility maintenance and repair services,72120000 - Nonresidential building construction services
Shea Rose,Embodied Vocal Coach; Recording Artist & Performer; Music Event Curator; Yoga and Wellness Instructor,MWBE,"SBE, SLBE",,No,Yes,"29 Elm Hill Park, Boston, MA 02121",Boston,MA,02121,Jushea Rose,Jushea Rose (Owner),(617) 903-7919,,info@shearose.com,www.shearose.com,Sole Proprietorship,Yes,5/1/2011,Less than 10,ET - Entertainment/Entertainer,"COH - Consultants: Health, Psychological",TA - Training (see also ED),711130 - Musical Groups and Artists ,"711320 - Promoters of Performing Arts, Sports, and Similar Events without Facilities ",611699 - All Other Miscellaneous Schools and Instruction ,90150000 - Entertainment services,90130000 - Performing arts,
"Love Child, LLC","Flower and Bottle Shop, Operating as a Traditional Florist and a Seller of Beer, Wine, and Spirits. ",WBE,SLBE,,No,Yes,"364 West Broadway, Boston, MA 02127",Boston,MA,02127,Crystal Mills,"Crystal Mills, Co-Founder",(617) 480-5512,,info@lovechild.co,www.lovechild.co,Partnership,No,05/01/2020,Less than 10,"FO - Floral (Arrangement, Maintenance)","CS - Concession Stands (Food, Newspa[er, Cigarettes, etc.)",,453110 - Florists ,"445310 - Beer, Wine, and Liquor Stores ",,10340000 - Fresh cut floral bouquets,10340000 - Fresh cut floral bouquets,
LCG Brands Consulting,Marketing Presentations; Leadership Development; Personal Brand Coaching; Media Coaching; Marketing Workshops,MWBE,SBE,,No,No,"23 Pleasant St, Marblehead, MA 01945",Marblehead,MA,01945,Jodi-Tatiana Charles,Jodi-Tatiana Charles Marketing Strategist,(888) 361-4601,,jodi@lcgbrands.com,www.lcgbrands.com,Limited Liability Company,No,9-12-2009,Less than 10,BU - Business Management Consultants,,,541613 - Marketing Consulting Services ,,,80140000 - Marketing and distribution,,
Jadore Dance Company LLC,Dance Services; Mentorship ,MWBE,,,No,No,"20 Hovey Street, Quincy, MA 02171",Quincy,MA,02171,Shatell Maddrey,Shatell Maddrey - Owner ,(857) 249-6384,,info@jadoredancecompany.com,jadoredancecompany.com,Limited Liability Company,No,10/19/20,Less than 10,ET - Entertainment/Entertainer,,,711120 - Dance Companies ,,,90130000 - Performing arts,,
Plural,"Mission and Cause-Related Branding, Brand Strategy, Research, Positioning, Audience Segmentation, Messaging, Online Marketing, Offline Marketing, Design, Visual Identity, Branding Programs, Campaigns, Advertising, Print Design, Screen Design, 3d, 4d, Video Animation, Web, Consulting, Brand Equity Index, Communication Planning, Assessment and Evaluation, Stakeholder Workshops, Persona Analysis, Lectures, Master Classes, Workshops",MWBE,SLBE,,No,Yes,"35 Park Street, Dorchester, MA 02132",Dorchester,MA,02132,Margarita Barrios Ponce,"Owner, Director of Creative and Strategy",(617) 283-3501,,mbarrios@pluralco.com,www.pluralco.com,,No,2007,Less than 10,AD - Advertising/Audovisual Graphic Design/Marketing Public Relations,COD - Consultants: Design,MK - Marketing,541430 - Graphic Design Services,541613 - Marketing Consulting Services ,541910 - Marketing Research and Public Opinion Polling,82100000 - Advertising,82140000 - Graphic design,
"Francisco Floors, LLC",Floor Installation Services and Consulting,,SLBE,,No,Yes,"1220 Adams Street, Dorchester, MA 02124",Dorchester,MA,02124,Ruben Almeida,Owner,(603) 864-9955,,franciscofloors77@gmail.com,,,Yes,2019,Less than 10,"FL - Floor Contractors (Carpet, Tile, Linoleum)",,,238330 - Flooring Contractors,,,52100000 - Floor coverings,,
"T.J. Mannion Company, Inc.",Carpentry; Concrete/Masonry; General Contractor; Floors; Locksmith; Painting,WBE,SLBE,,No,Yes,"21 North Monroe Terrace, Dorchester, MA 02122",Dorchester,MA,02122,Julia Mannion,President,(617) 288-0746,(617) 822-9877,mannionconstruction@yahoo.com,,,Yes,1982,Less than 10,CA - Carpentry,CM - Concrete & Masonry Contractors,GC - General Contractors,238350 - Finish Carpentry Contractors,238140 - Masonry Contractors ,238330 - Flooring Contractors,72150000 - Specialized trade construction and maintenance services,,
Triwellness Holistic Center,"Wellness Center Offering Massage Therapies, Reflexology, Reiki, Chair Massage",WBE,SLBE,,No,Yes,"699 East Broadway, South Boston, MA 02127",South Boston,MA,02127,Jean Provenzano,Owner,(617) 543-6717,,triwellnessholisticcenter@gmail.com,,,No,2017,Less than 10,"AHS - Health Care (Providers, Services)",,,812199 - Other Personal Care Services ,,,85100000 - Comprehensive health services,,
"Prime Concrete and Sitework, LLC","Rebar Installation; Concrete Forms Work, Including Stairpan and Opening Infills, Slab and Trench, Patching and Repair Services; Cast In Place Systems; Forming and Placing of Columns; Pad and Curbs; Topping and Structural Slabs, Concrete-Related Construction; Construction Project Management and Services",MBE,,,Yes,No,"570 East Street, South Boston, MA 02127",South Boston,MA,02127,Brendt Gonsalves,Principal,(617) 293-3743,,bgonsalves@primeconcrete.com,,,Yes,2021,11 - 20,CM - Concrete & Masonry Contractors,,,238110 - Poured Concrete Foundation and Structure Contractors ,,,30110000 - Concrete and cement and plaster,,
Renewable Renegade,Energy Brokering; LEED Training; Project Management Training; High and Low Pressure SPF Training and Solar Energy Consulting and Installation,MWBE,,,Yes,No,"1125 Blue Hill Avenue, Dorchester, MA 02124",Dorchester,MA,02124,Dorcas Bethsaida Griffith,Owner,(857) 246-8733,(844) 889-5504,solsisenergy@gmail.com,,Limited Liability Company,No,2014,Less than 10,CON - Consultants: Environmental,,,221114 - Solar Electric Power Generation ,,,26130000 - Power generation,,
"D.A. Martin Productions, LLC",Full Service Film Production Company; Audio/Visual/Multi Media Production; Entertainment/Education Programming,MWBE,"SBE, SLBE",,No,Yes,"361 Newbury Street, Boston, MA 02115",Boston,MA,02115,Dominga Martin,Dominga Martin (Principal),(718) 785-7709,,hello@domingamartin.com,"www.domingamartin.com, www.damartinproductions.com",Limited Liability Company,No,2021,Less than 10,TV - Television/Production,,,512110 - Motion Picture and Video Production ,"711320 - Promoters of Performing Arts, Sports, and Similar Events without Facilities ","711510 - Independent Artists, Writers, and Performers ",45120000 - Photographic or filming or video equipment,45110000 - Audio and visual presentation and composing equipment,82150000 - Professional artists and performers
"Aponte Development, Inc.","Design-Build Construction Firm Specializing in Historic Restorations, subdivisions and New Construction",MWBE,,,Yes,No,"1 McCraw Street, Roslindale, MA 02131",Roslindale,MA,02131,Neselle Aponte,CEO,(617) 477-4733,,info@apontedevelopment.com,,,Yes,2013,Less than 10,CN - Construction Management: Small Commercial Projects,CE - Construction Estimating,,236116 - New Multifamily Housing Construction (except For-Sale Builders) ,236118 - Residential Remodelers ,236115 - New Single-Family Housing Construction (except For-Sale Builders) ,72150000 - Specialized trade construction and maintenance services,,
Boston Speech Therapy,"Speech Therapy Services, Language Therapy",MWBE,,,No,No,"816 E. 5th Street, South Boston, MA 02127",South Boston,MA,02127,Tanya Acosta,Executive Director,(857) 257-9081,,bostonspeech1@gmail.com,,,No,2012,Less than 10,"ED - Education (see also OS, TA)",COV - Consultants: Translation,"AHS - Health Care (Providers, Services)","621340 - Offices of Physical, Occupational and Speech Therapists, and Audiologists ",,,86130000 - Specialized educational services,,
"Shanti Boston, LLC","Indian Cuisine, Restaurant and Catering",MWBE,SLBE,,No,Yes,"51 Hutchings Street, Dorchester, MA 02121",Dorchester,MA,02121,Rokeya Begum,Owner,(617) 325-3900,,rokeya@shantiboston.com,www.shantiboston.com,Limited Liability Company,No,2012,21 - 40,CT - Catering,"FD - Food Products, Services",,722320 - Caterers,722511 - Full-Service Restaurants ,,90100000 - Restaurants and catering,,
"Solmon Alam, LLC",Indian Cuisine; Restaurant and Catering,MWBE,SLBE,,No,Yes,"51 Hutchings Street, Dorchester, MA 02121",Dorchester,MA,02121,,Owner,(617) 929-3900,,rokeya@shantiboston.com,www.shantiboston.com,Limited Liability Company,No,2000,11 - 20,CT - Catering,"FD - Food Products, Services",,722320 - Caterers,722511 - Full-Service Restaurants ,,90100000 - Restaurants and catering,,
"Shanti Acquisition, LLC",Real Estate Development,MWBE,SLBE,,No,No,"51 Hutchings Street, Dorchester, MA 02121",Dorchester,MA,02121,,Owner,(617) 955-4900,,rokeya@shantiboston.com,www.shantidevelopments.com,,Yes,2016,Less than 10,"RE - Real Estate (Development, Management, Sales and Appraisals)",,,531390 - Other Activities Related to Real Estate ,236117 - New Housing For-Sale Builders ,,80130000 - Real estate services,,
HolliBalance Well-being Center LLC,Acupuncture; Chinese herbal medicine,MWBE,,,No,Yes,"101 Federal Street, Boston, MA 02110",Boston,MA,02110,Yi Song,Yi Song,(617) 344-1441,,info@hollibalance.com,https://www.yourhealthandlongevity.com,Limited Liability Company,No,2008,Less than 10,"AHS - Health Care (Providers, Services)",,,621399 - Offices of All Other Miscellaneous Health Practitioners ,,,85100000 - Comprehensive health services,,
E.R. Enterprises LLC,"Restaurant. Providing Food Products and Services
",MBE,"SBE, SLBE",,No,No,"180 Lincoln street, Boston, MASSACHUSETTS 02111",Boston,MASSACHUSETTS,02111,Francois Firmin,Francois Firmin/ Owner,(857) 250-2165,,f.eddy@savvorbostonlounge.com,savvorbostonlounge.com,Limited Liability Company,No,2012,11 - 20,"FD - Food Products, Services",,,722511 - Full-Service Restaurants ,,,90100000 - Restaurants and catering,,
"Fleet Ad Media, LLC",LED Digital Mobile Billboards and GEO-Fencing Advertising,MBE,,,No,Yes,"15 Rockingham Road, Mattapan, MA 02126",Mattapan,MA,02126,Yionel Torres,Owner,(617) 980-6506,,yionel@fleetmediaads.com,www.fleetadmediallc.com,,No,2019,Less than 10,AD - Advertising/Audovisual Graphic Design/Marketing Public Relations,MK - Marketing,ET - Entertainment/Entertainer,541850 - Outdoor Advertising,541890 - Other Services Related to Advertising ,,82100000 - Advertising,,
