company_name,services_provided,mbe_wbe_cert,small_local_cert,veteran_cert,sdo_certified,city_registered,address,city,state,zipcode,contact_name,contact_title,phone,fax,email,website,business_type,construction,date_established,number_employees,cob_category_codes1,cob_category_codes2,cob_category_codes3,naics_codes1,naics_codes2,naics_codes3,unspsc_code1,unspsc_code2,unspsc_code3
FlightView Inc.,Real time flight tracking solutions and consulting services   ,WBE,SLBE,,No,No,"214 Lincoln Street, Boston, MA 2134",Boston,MA,2134,Lorraine Flynn,,(617) 787-4200,(617) 787-2570,,,Corporation,No,01/01/1981,Less than 10,"CP - Computer (Hardware, Software, Design, Data Processing (see also COS, COT)",COS - Consultants: Systems Analysis,COT - Consultants: Telecommunications,541511 - Custom Computer Programming Services ,,,,,
"Focus Consulting, LLC",Software engineering consulting services   ,MBE,,,No,No,"716 Roxboro Place, NW, Washington, DC 20011",Washington,DC,20011,Anteneh Addis,,(302) 290-6238,,anteneh@focusconsulting.io,,Limited Liability Company,No,01/01/2019,Less than 10,"CP - Computer (Hardware, Software, Design, Data Processing (see also COS, COT)",COS - Consultants: Systems Analysis,,541511 - Custom Computer Programming Services ,541512 - Computer Systems Design Services ,,,,
Foster's Electric Service,"Industrial and commercial electrical contracting, installation and repair; fire and burgular alarms ",MBE,SLBE,,No,Yes,"702 Walk Hill Street, Mattapan, MA 2126",Mattapan,MA,2126,"Foster Earl, Sr.",,(617) 296-3820,(617) 296-5047,fostersr@comcast.net,,Corporation,Yes,01/01/1966,Less than 10,EL - Electrical Contractors,,,238210 - Electrical Contractors and Other Wiring Installation Contractors,,,,,
"Four Season, LLC","Maintenance, janitorial, primarily commercial; construction, primarily concrete, carpentry, foundation work",MBE,SLBE,,No,Yes,"99 Williams Street, Hyde Park, MA 2136",Hyde Park,MA,2136,Miguel Mourino,,(857) 500-9075,,mmourino@fourssd.com,,Limited Liability Company,No,01/01/2016,Less than 10,CN - Construction Management: Small Commercial Projects,"JA - Janitorial Services/Supplies (see also MA, RS)",PA - Painting and Papering Contractors,561720 - Janitorial Services ,561730 - Landscaping Services,,,,
Fraser Polyengineering Services,Civil engineering design consultant,MBE,,,Yes,Yes,"236 Huntington Avenue, Suite 404, Boston, MA 2115",Boston,MA,2115,Kurt Fraser,,(617) 291-2423,,kurt@fraseres.com,,Corporation,No,01/01/2009,Less than 10,"COA - Consultants: Architecture, Engineering",,,541330 - Engineering Services,,,,,
"Front Line, Inc.",Construction services:  cleaning; general labor; demolition; final cleaning; water/mold remediation   ,WBE,,,Yes,Yes,"58 Mellen Street, Hopedale, MA 1747",Hopedale,MA,1747,Nancy Salter,,(508) 634-6600,(508) 634-3611,kharney@frontlineinc.info,,Corporation,Yes,01/01/1998,41 - 100,"SI - Sitework (Excavation, Demolition, Utilities, Sewage, see also GC)",,,238990 - All Other Specialty Trade Contractors,,,,,
Fundamental Optical Solutions,Engineering services for optical design,WBE,,,No,No,"543 Massachusetts Avenue, #3, Boston, MA 2118",Boston,MA,2118,Golshan Coleiny,,(978) 809-7759,,gcoleiny@fundamentalopticalsolutions.com,,Limited Liability Company,No,01/01/2020,Less than 10,AE - Architects/Engineers,COS - Consultants: Systems Analysis,COD - Consultants: Design,541330 - Engineering Services,541690 - Other Scientific and Technical Consulting Services,,,,
"G & O, Inc.","Electrical Contractors , Electrical Contracting Services   ",MBE,SLBE,,No,No,"115 King Street, Dorchester, MA 02122",Dorchester,MA,02122,John Oliveira,,(617) 282-4400,(617) 282-4444,john@gandoinc.com,,Corporation,Yes,01/01/1994,21 - 40,EL - Electrical Contractors,,,238210 - Electrical Contractors and Other Wiring Installation Contractors,,,26120000 - Electrical wire and cable and harness,,
"General A.C. and Heating, Co.",Installation and repair of air conditioning and heating systems; plumbing repairs and pipefitting   ,MBE,SLBE,,No,Yes,"7 Gaston Street, Dorchester, MA 2121",Dorchester,MA,2121,Pamela Woodley,,(617) 427-7370,(617) 427-7371,pam@general-air.net,,Corporation,Yes,01/01/1981,Less than 10,"ME - Mechanical Contractors (HVAC, Plumbing, Insulation, Service, see also GC, PB)",PB - Plumbing,,,,,,,
"General Foundries, Inc.",Construction castings:  manhole rings and covers; gratings; catch basins; valve and service boxes; etc.   ,MBE,SBE,,No,No,"1 Progress Road, Brunswick, BNJ 8902",Brunswick,BNJ,8902,Rita Todani,,(732) 951-9001,(732) 951-9002,rajs@generalfoundries.com,,Corporation,Yes,01/01/1983,21 - 40,SU - Suppliers,,,423510 - Metal Service Centers and Other Metal Merchant Wholesalers ,,,,,
"Geo s Electrical Service, Inc.",Electrical contractor Resident and Commercial  ,MBE,SLBE,,Yes,Yes,"52 Evelyn Street, Dorchester, MA 2126",Dorchester,MA,2126,George Graham,,(617) 296-1124,(617) 296-7527,geoselectric@gmail.com,,Corporation,Yes,01/01/1985,Less than 10,EL - Electrical Contractors,,,238210 - Electrical Contractors and Other Wiring Installation Contractors,,,,,
"GMT Architects, Inc.","Comprehensive architectural services--in residential, commercial, institutional, transportation and urban design ",MBE,,,Yes,Yes,"20 Becket Street, #2, Dorchester, MA 2124",Dorchester,MA,2124,G. Michael Tzerai,,(617) 291-4670,,gmtarch9@gmail.com,,Sole Proprietorship,No,01/01/1989,Less than 10,AE - Architects/Engineers,"COA - Consultants: Architecture, Engineering",COB - Consultants: City Planning,,,,,,
Giugliano Corp.,Street construction; paving surfacing; sewer and water repairs; catch basin rebuild and repairs   ,WBE,SBE,,No,Yes,"7 Beacham Street, Everett, MA 2149",Everett,MA,2149,Gilfroia Giugliano,,(617) 387-7841,(617) 387-7897,giuglianocorp@aol.com,,Corporation,Yes,01/01/1975,20-Nov,CM - Concrete & Masonry Contractors,CE - Construction Estimating,PV - Paving Contractors,"237310 - Highway, Street, and Bridge Construction ",,,,,
Glee All Phase,Carpentry; painting; flooring; property maintenance   ,MBE,SLBE,,No,No,"15 Newcroft Circle, Mattapan, MA 2126",Mattapan,MA,2126,Gary Lee,,(617) 756-8329,,gleeallphase@gmail.com,,Sole Proprietorship,Yes,,Less than 10,PA - Painting and Papering Contractors,"FL - Floor Contractors (Carpet, Tile, Linoleum)",,238320 - Painting and Wall Covering Contractors,238330 - Flooring Contractors,,,,
"Global Link Language Services, Inc.",Translation and localization services; multilingual copywriting; and interpreting,WBE,,,Yes,Yes,"71 Commercial Street, #218, Boston, MA 2109",Boston,MA,2109,Melissa Letteri,,(617) 451-6655,,info@languagetrarnslate.com,,Sole Proprietorship,No,01/01/1996,Less than 10,COV - Consultants: Translation,,,541930 - Translation and Interpretation Services,,,82110000 - Writing and translations,,
Global Star,"Personal services:  livery, delivery",MBE,SLBE,,No,No,"1137 Adams Street, Dorchester, MA 2124",Dorchester,MA,2124,Kevin Le,,(857) 308-9692,,nguyenkhang_vt@yahoo.com,,Sole Proprietorship,No,01/01/2017,Less than 10,"TR - Travel, Transportation (Travel Agencies, Planning, Limo Services)",,,485310 - Taxi Service ,492210 - Local Messengers and Local Delivery,,,,
Global Villages Translation and Interpreting Services,Translation and interpretation services,MBE,SLBE,,No,No,"281 Roslindale Avenue, Roslindale, MA 2131",Roslindale,MA,2131,James Colimon,,(617) 291-9054,,jrcolimon@me.com,,Sole Proprietorship,No,01/01/2019,Less than 10,COV - Consultants: Translation,,,541930 - Translation and Interpretation Services,,,,,
GM2 Associates,"Consulting Engineering Services for Design and Construction; Including Site/Civil, Structural, Traffic, Geotechnical, and Hydraulic/Hydrology Engineering, and Survey",MBE,,,Yes,No,"115 Glastonbury Boulevard, Glastonbury, CT 06033",Glastonbury,CT,06033,Madan Gupta,"Manish Gupta, President and CEO",(860) 659-1416,,sbartkus@gm2inc.com,,Corporation,No,1988,Greater than 100,AE - Architects/Engineers,,,541330 - Engineering Services,541690 - Other Scientific and Technical Consulting Services,,81100000 - Professional engineering services,,
"GNC Consulting, Inc.",IT Consulting Services   ,MBE,SBE,SVOB,No,No,"21195 S. Langrange Road, Frankfort, IL 60423",Frankfort,IL,60423,Garry Cooper,,(815) 469-7255,(815) 981-4029,garry.cooper@gnc-consulting.com,https://gnc-consulting.com,Corporation,No,01/01/1995,41 - 100,"CP - Computer (Hardware, Software, Design, Data Processing (see also COS, COT)",COS - Consultants: Systems Analysis,,541511 - Custom Computer Programming Services ,"518210 - Data Processing, Hosting, and Related Services",541519 - Other Computer Related Services,81110000 - Computer services,81160000 - Information Technology Service Delivery,
Good Egg Marketing,"Market research, branding, marketing strategies, websites, social media",WBE,SLBE,,No,Yes,"32 Cheshire Street, Jamaica Plain, MA 2130",Jamaica Plain,MA,2130,Myrna Greenfield,,(617) 642-3562,,myrna@goodeggmarketing.com,,Sole Proprietorship,No,01/01/2010,Less than 10,AD - Advertising/Audovisual Graphic Design/Marketing Public Relations,,,541613 - Marketing Consulting Services ,541611 - Administrative Management and General Management Consulting Services ,541910 - Marketing Research and Public Opinion Polling,,,
Great GetAways,"Travel, meeting and event management company",WBE,,,Yes,Yes,"313 Cambridge Street, Boston, MA 2114",Boston,MA,2114,Diane Mabardi,,(617) 966-0070,,diane@ggatravel.com,,Corporation,No,01/01/1987,Less than 10,"TR - Travel, Transportation (Travel Agencies, Planning, Limo Services)",,,561510 - Travel Agencies,,,90120000 - Travel facilitation,,
"Green Castle Business Solutions, LLC",Office supply distributor   ,MBE,SLBE,,No,Yes,"15 Hallowell Street, Boston, MA 2126",Boston,MA,2126,Keith Castle,,(617) 307-4461,(877) 557-5124,kcastle@greencastlebusiness.com,,Corporation,No,01/01/2009,Greater than 100,SU - Suppliers,,,424120 - Stationery and Office Supplies Merchant Wholesalers ,,,44120000 - Office supplies,,
"Green International Affiliates, Inc.",Transportation engineering; water resources engineering; structural engineering; civil/site engineering; land survey,MBE,,,Yes,Yes,"239 Littleton Road, Suite 3, Westford, MA 1886",Westford,MA,1886,Ko Ishikura,,(978) 923-0400,(978) 399-0033,info@greenintl.com,,Corporation,No,01/01/1954,Greater than 100,AE - Architects/Engineers,"COA - Consultants: Architecture, Engineering",,541330 - Engineering Services,541620 - Environmental Consulting Services,,,,
H.B. Plumbing and Heating,Plumbing Contractor:  Installation of New Fixtures; Rehabs; Commercial and Residential,MBE,SLBE,,No,Yes,"37 Callender Street, Dorchester, MA 2124",Dorchester,MA,2124,"Hilliard Baker, Jr.","Hilliard Baker, Jr.",(781) 817-9045,,hbph@contractor.net,,Sole Proprietorship,Yes,01/01/2017,Greater than 100,PB - Plumbing,,,"238220 - Plumbing, Heating, and Air-Conditioning Contractors ",,,30180000 - Plumbing fixtures,,
"H2O Applied Technologies, LLC","Design/installation of water and energy conservation retrofits of existing buildings; site audits, utility analysis, water/energy savings calculations; conservation measure design, procurement, and installation; measurement and verification   ",WBE,SLBE,,Yes,Yes,"8 Newbury Street, Boston, MA 02116-3260",Boston,MA,02116-3260,Cynthia Stillinger,,(617) 428-8600,(617) 249-0707,cstillinger@h2oappliedtech.com,,Limited Liability Company,No,01/01/2004,21 - 40,"COA - Consultants: Architecture, Engineering","ME - Mechanical Contractors (HVAC, Plumbing, Insulation, Service, see also GC, PB)",PB - Plumbing,541330 - Engineering Services,"238220 - Plumbing, Heating, and Air-Conditioning Contractors ",541690 - Other Scientific and Technical Consulting Services,72100000 - Building and facility maintenance and repair services,81100000 - Professional engineering services,
"Hammer + Walsh Design, Inc.",Landscape architectural services   ,,SBE,SVOB,Yes,Yes,"41 Fuller Brook Avenue, Needham, MA 02492",Needham,MA,02492,David Walsh,"David Walsh, President",(617) 439-0125,(617) 426-0046,nh@hammerwalsh.com,WWW.HAMMERWALSH.COM,Corporation,No,01/01/2010,Less than 10,"LD - Landscaping (Design, Architects)",,,541320 - Landscape Architectural Services,,,30120000 - Roads and landscape,,
"Hapi African Gourmet, LLC",Producer of food for wholesale through stores and institutional food service; they sell their products at farmers markets,MWBE,,,Yes,Yes,"196 Quincy Street, Dorchester, MA 2121",Dorchester,MA,2121,Paulette Ngachoko,,(617) 608-8933,,pngachoko@hapiafricangourmet.com,,Limited Liability Company,No,01/01/2017,Less than 10,"FD - Food Products, Services",,,311999 - All Other Miscellaneous Food Manufacturing ,,,50190000 - Prepared and preserved foods,,
"HealthDataViz, LLC",Data visualization consulting and training for healthcare and public health organizations,WBE,,,Yes,No,"4 Longfellow Place, #3505, Boston, MA 2114",Boston,MA,2114,Sandra Lawson,,(617) 653-6608,,sandy@healthdataviz.com,,Limited Liability Company,No,01/01/2013,Less than 10,"COH - Consultants: Health, Psychological",,,541690 - Other Scientific and Technical Consulting Services,,,,,
Heather Buechler Art,Fine art retail; prints; framing; commissions,WBE,,,No,Yes,"450 Harrison Avenue, #215, Boston, MA 2118",Boston,MA,2118,Heather Buechler,,(617) 388-4576,,heatherbuechlerart@gmail.com,,Sole Proprietorship,No,01/01/2000,Less than 10,GM - Retail Sales of Art & Framing,AD - Advertising/Audovisual Graphic Design/Marketing Public Relations,RT - Retail Sales of Art & Framing,453998 - All Other Miscellaneous Store Retailers (except Tobacco Stores) ,"711510 - Independent Artists, Writers, and Performers ",,82150000 - Professional artists and performers,,
Heritage Flag Company,"Custom order flags, banners and signs; flagpole installation  ",WBE,SLBE,,No,Yes,"100 Franklin Street, Allston, MA 2134",Allston,MA,2134,Amy MacDonald,,(617) 388-7437,,amy@heritageflag.com,,Corporation,No,01/01/1961,Less than 10,RT - Retail Sales of Art & Framing,,,453998 - All Other Miscellaneous Store Retailers (except Tobacco Stores) ,238990 - All Other Specialty Trade Contractors,314999 - All Other Miscellaneous Textile Product Mills ,,,
"Hicks Auto Body, Inc.",Auto Body Repair and Refinishing; Auto Detailing and Reconditioning,MBE,SLBE,,Yes,Yes,"10 Talbot Ave, Dorchester, MA 02124-2903",Dorchester,MA,02124-2903,"Willie Hicks, Jr.",,(617) 825-1545,(617) 825-8495,hicksautobody@aol.com,www.hicksautobodyinc.com,Corporation,No,01/01/1970,Less than 10,"AU - Automobile (Sales, Services, Leasing, Rental)",,,"811121 - Automotive Body, Paint, and Interior Repair and Maintenance ",811192 - Car Washes ,811118 - Other Automotive Mechanical and Electrical Repair and Maintenance ,25100000 - Motor vehicles,,
"Highland Development Group, LLC",Real estate development and consulting services,MBE,SLBE,,No,No,"14 John Eliot Square, Suite 2D, Roxbury, MA 2119",Roxbury,MA,2119,Armindo Goncalves,,(617) 319-0745,,hdgconsultants@gmail.com,,Limited Liability Company,No,01/01/2020,Less than 10,"RE - Real Estate (Development, Management, Sales and Appraisals)",,,531390 - Other Activities Related to Real Estate ,,,,,
"Hogu Technology Services, LLC",Information technology; computer systems networking; cloud solutions; 3D visualization; network security; technical support; computer repair and recovery   ,MBE,,,Yes,No,"7 Holburn Street, Boston, MA 2121",Boston,MA,2121,Harris Hogu,,(617) 642-6098,,info@htservices-llc.com,,Limited Liability Company,No,01/01/2018,Less than 10,"CP - Computer (Hardware, Software, Design, Data Processing (see also COS, COT)",,,,,,,,
"Hilton Realty, Inc.","Real estate sales, rentals, property management, project management, and marketing research   ",MWBE,SLBE,,Yes,Yes,"35 Bailey Street, Dorchester, MA 2124",Dorchester,MA,2124,Meichelle Ferguson,,(617) 905-9527,,meichelle@hiltonrealtyhomes.com,,Corporation,No,01/01/2018,Less than 10,"RE - Real Estate (Development, Management, Sales and Appraisals)",RS - Residential Services,,531120 - Lessors of Nonresidential Buildings (except Miniwarehouses) ,541910 - Marketing Research and Public Opinion Polling,541922 - Commercial Photography ,,,
"Home Is Best Home Care, LLC",Home care services,MWBE,,,No,No,"336 Baker Avenue, Concord, MA 1742",Concord,MA,1742,Jaria Mukasa,,(978) 435-3775,(978) 405-2103,jaria@homeisbestcare.com,,Limited Liability Company,No,01/01/2014,Less than 10,"AHS - Health Care (Providers, Services)",ES - Elderly Services,,621610 - Home Health Care Services,,,,,
"Hoon Construction Services, Inc.","Commercial painting, floor covering, drywall and related construction and installation services, as permitted under Chapter 156B; supply construction materials, i.e. kitchen/bathroom cabinets, appliances, etc.; interior/exterior design services; small scale real estate development   ",MWBE,SBE,,No,No,"14 Page Terrace, Stoughton, MA 2072",Stoughton,MA,2072,Shelley Hoon,,(617) 697-2215,,shoon@hooncs.com,,Corporation,Yes,01/01/2004,Less than 10,PA - Painting and Papering Contractors,"FL - Floor Contractors (Carpet, Tile, Linoleum)",CA - Carpentry,238990 - All Other Specialty Trade Contractors,238330 - Flooring Contractors,236118 - Residential Remodelers ,,,
"Host Events, Inc.",Service providing insured bartenders for corporate events   ,MWBE,SLBE,,No,No,"522 East 6th Street, Boston, MA 2127",Boston,MA,2127,Nina Carazas,,(339) 203-5923,,hello@hostdrinks.com,,Corporation,No,01/01/2017,Less than 10,CT - Catering,,,722320 - Caterers,,,,,
Hub Glass Services Inc.,"Furnish and/or install glass and safety glazing material into windows, storefronts, mirrors, etc.; suppliers of auto glass, mirrors, tub enclosures   auto glass, mirrors, tub enclosures",WBE,SBE,,Yes,No,"216 McGrath Highway, Somerville, MA 2143",Somerville,MA,2143,Sharon Tankel,,(617) 625-6661,(617) 625-0223,hubglass@aol.com,,Corporation,Yes,01/01/1931,20-Nov,GG - Glass/Glazing Contractors,"MA - Maintenance (Industrial, Commericial, Residential, see also JA, RS)",RT - Retail Sales of Art & Framing,238150 - Glass and Glazing Contractors ,,,,,
"Hubbell Group, Inc. The",Media relations; editorial services; crisis communications; speech writing; social media; speakers bureau; internal communications message development; subject matter expert (SME) development; public relations and marketing; content marketing   ,WBE,SBE,,Yes,Yes,"859 Willard Street, Quincy, MA 2169",Quincy,MA,2169,Constance Hubbell,,(781) 878-8882,(781) 878-8883,hubbell@hubbellgroup.com,,Corporation,No,01/01/1995,20-Nov,AD - Advertising/Audovisual Graphic Design/Marketing Public Relations,COP - Consultants: Public Relations,COE - Consultants: Editorial,541820 - Public Relations Agencies,541613 - Marketing Consulting Services ,,,,
Hunter Signs,"Signage, awnings, vehicle lettering, banners, etc.   ",MWBE,SLBE,,No,No,"120 Business Street, Hyde Park, MA 2136",Hyde Park,MA,2136,Wanda Hunter,,(617) 347-6734,(617) 360-9711,huntersigns@rcn.com,,Sole Proprietorship,No,,Less than 10,PT - Printers,,,541430 - Graphic Design Services,,,55100000 - Printed media,,
Hurst Landscape and Site Services Inc.,"Contract landscape construction and site services including plantings, lawns, excavation, drainage, pavers, and walls",MBE,SLBE,,Yes,Yes,"24 Idaho Street, Mattapan, MA 02126",Mattapan,MA,02126,David Hurst,David Hurst - President,(617) 333-7431,(617) 333-7433,dhurst9425@aol.com,hurstlandsapeandsite.com,Corporation,Yes,01/01/1993,Less than 10,,,,561730 - Landscaping Services,238140 - Masonry Contractors ,238910 - Site Preparation Contractors,11110000 - Earth and stone,21100000 - Agricultural and forestry and landscape machinery and equipment,
Hyggemail dba Minuteman Press Natick,High quality print products; design services; managing work flow of corporate accounts   ,MWBE,,,Yes,No,"251 W. Central Street, Natick, MA 1760",Natick,MA,1760,Pramitha Chowrira,,(508) 655-0875,(508) 653-1185,info@mpnatick.com,,Limited Liability Company,No,01/01/2017,Less than 10,PT - Printers,AD - Advertising/Audovisual Graphic Design/Marketing Public Relations,,323111 - Commercial Printing (except Screen and Books) ,541430 - Graphic Design Services,511199 - All Other Publishers ,55100000 - Printed media,,82121500 - Printing Services
Hypnalgesics LLC dba Comfort Talk,Communication and interpersonal skill training; training of helathcare professionals in better managing patients' and their own stress   ,WBE,SBE,,No,No,"157 Ivy Street, Brookline, MA 2446",Brookline,MA,2446,Elvira Lang,,(978) 404-9724,(617) 734-9087,drevlang@gmail.com,,Limited Liability Company,No,01/01/2006,Less than 10,COG - Consultants: Human Resources,"COH - Consultants: Health, Psychological",TA - Training (see also ED),611430 - Professional and Management Development Training ,611710 - Educational Support Services,,,,
Imex Cargo LLC,"Transportation, logistics, air freight, trucking   ",WBE,SLBE,,No,Yes,"440 William F. McClellan Highway, East Boston, MA 2128",East Boston,MA,2128,Michelle DeFronzo,,(617) 718-4639,,michelle@imexcargo.com,,Limited Liability Company,No,01/01/2000,Less than 10,COU - Consultants: Transportation,TK - Trucking (Waste Disposal Commodities Transport),DI - Direct Mail Services,481112 - Scheduled Freight Air Transportation ,"484110 - General Freight Trucking, Local ",,,,
In Order Business Development Solutions,"Diversity, Equity and Inclusion Consultant providing diversity strategies, tracking, monitoring and management, MBE/WBE/VBE/DBE outreach, and community relations.  Technical Assistance Provider, providing diverse business certification services and contractor pre-qualifications.",MWBE,SLBE,,No,Yes,"P.O. Box 190573, Roxbury, MA 2119",Roxbury,MA,2119,Shelley Webster,"Shelley Webster, Owner",(617) 719-7869,,shelley@inorderbusiness.com,www.inorderbusiness.com,Sole Proprietorship,No,01/01/2014,Less than 10,COM - Consultants: Management,TA - Training (see also ED),,541611 - Administrative Management and General Management Consulting Services ,541618 - Other Management Consulting Services ,,80100000 - Management advisory services,,
"Indput, LLC",Commercial real estate consulting and technologies,MBE,,,Yes,No,"645 Walk Hill Street, Boston, MA 2126",Boston,MA,2126,Justin Mott,,(617) 237-0717,,indputllc@gmail.com,,Limited Liability Company,No,01/01/2018,Less than 10,"RE - Real Estate (Development, Management, Sales and Appraisals)",,,531390 - Other Activities Related to Real Estate ,,,,,
"Innovee Consulting, LLC",Public asset management; IT staff augmentation; customer service management,MBE,SBE,,No,No,"575 Lexington Avenue, 4th Floor, New York, NY 10022",New York,NY,10022,Sachin Garg,,(646) 531-4899,,govt@innovee.com,,Limited Liability Company,No,01/01/2014,Less than 10,"CP - Computer (Hardware, Software, Design, Data Processing (see also COS, COT)",COS - Consultants: Systems Analysis,COT - Consultants: Telecommunications,541512 - Computer Systems Design Services ,541511 - Custom Computer Programming Services ,541611 - Administrative Management and General Management Consulting Services ,,,
"Interstate Rental Service, Inc.",Rental equipments and services for special events   ,,SLBE,,No,Yes,"384 Amory Street, Boston, MA 2130",Boston,MA,2130,Edward Jacobs,,(617) 522-6200,(617) 522-0136,info@interstaterentalservice.com,,Corporation,No,01/01/1935,Less than 10,EP - Equiment Rental (Heavy Construction),,,,532310 - General Rental Centers,,,,
"Intueor Consulting, Inc.",Management consulting services; strategic advisory services; strategic planning; program and project management; business transformation; procurement assistance; organizational change management; transit and transportation,MBE,,,Yes,No,"7700 Irvine Center Drive, Irvine, CA 92618",Irvine,CA,92618,Vijay Mididaddi,,(949) 753-9010,,nandivada@intueor.com,,Corporation,No,01/01/2005,21 - 40,BU - Business Management Consultants,COU - Consultants: Transportation,,541611 - Administrative Management and General Management Consulting Services ,,,,,
"J & S Valve, Inc.",Manufacturers of valves for pipeline flow control   ,WBE,SBE,,No,No,"2323 1st Street, Huffman, TX 77336",Huffman,TX,77336,Stacie Bolender,,(281) 324-3990,(281) 324-4595,smb@jandsvalve.com,,Corporation,Yes,01/01/2004,Less than 10,MU - Manufacturers,SU - Suppliers,,332919 - Other Metal Valve and Pipe Fitting Manufacturing ,,,,,
"J. Thibert Architectural Woodwork Installation, Inc.",Finish carpentry,WBE,,,Yes,No,"14 Amherst Road, Wilmington, MA 01887",Wilmington,MA,01887,Lucia Thibert,"Lucia Thibert, President",(617) 359-8330,,luciafthibert@icloud.com,,Corporation,Yes,01/01/2016,Less than 10,CA - Carpentry,,,238350 - Finish Carpentry Contractors,,,72110000 - Residential building construction services,,
"J.F. Shine Mechanical, Inc.",General and mechanical contractor supplying and installing plumbing and HVAC equipment and coordinating all associated trades,WBE,SLBE,,Yes,Yes,"2383 Centre Street, West Roxbury, MA 2114",West Roxbury,MA,2114,Anne Shine,,(617) 325-6300,(617) 325-6314,,,Corporation,Yes,01/01/1980,20-Nov,"ME - Mechanical Contractors (HVAC, Plumbing, Insulation, Service, see also GC, PB)",PB - Plumbing,GC - General Contractors,,,,,,
"Jackson Glass, Inc."," Mirror and Plate Glass Installation; Storefront Installation, Residential Commercial Glass",WBE,,,Yes,No,"511 CUMMINS HWY, Roslindale, MA 2131",Roslindale,MA,2131,Sandra DiMino,"Barbara Graffeo, Owner",(617) 522-0525,(617) 522-5506,lili@jacksonglassinc.net,,Corporation,Yes,01/01/1947,21 - 40,GG - Glass/Glazing Contractors,,,327215 - Glass Product Manufacturing Made of Purchased Glass ,,,30170000 - Doors and windows and glass,,
"JaMa Professional Cleaning, Inc.",Building services company,MWBE,,,Yes,Yes,"17 Alvarado Avenue, Boston, MA 2136",Boston,MA,2136,Maria Rivera Brown,,(617) 899-4389,,maria@jamapro.com,,Sole Proprietorship,No,01/01/2011,Less than 10,"JA - Janitorial Services/Supplies (see also MA, RS)","MA - Maintenance (Industrial, Commericial, Residential, see also JA, RS)",,561720 - Janitorial Services ,,,76110000 - Cleaning and janitorial services,,
